281,0281c,The only thing worse than being exploited by global capital is not being exploited by global capital'. Discuss,4.0,2/1/06,"Globalisation, Governance and Development",essay,Politics,SS,M,2243.0,95.0,23.0,0.0,0.0,0.0,0.0,0.0,0.0,1.0,23.6,4.1,simple assignment,f,1978,Portuguese,OSA,MA Globalisationa dn Development,1.0,1
281,0281d,A critical analysis of the role of the rating agencies in the politics of global finance,4.0,5/1/06,Global Finance,essay,Politics,SS,M,5153.0,204.0,42.0,0.0,0.0,1.0,0.0,0.0,0.0,1.0,25.3,4.9,simple assignment,f,1978,Portuguese,OSA,MA Globalisationa dn Development,1.0,1
285,0285a,Are Socrates views on pleasures in the Protagoras and the Gorgias compatible?,1.0,2/1/06,Introduction to Ancient Philosophy,essay,Philosophy,AH,M,1717.0,75.0,10.0,0.0,0.0,0.0,0.0,0.0,0.0,0.0,22.9,7.5,simple assignment,m,1986,English,OSA,Philosophy,1.0,0
285,0285b,"In connection with the Second Meditation, Hobbes said it was possible that something that thinks should be something corporeal. Do Descartes' arguments succeed in ruling this possibility out?",1.0,10/1/05,Descartes &amp; Locke,essay,Philosophy,AH,M,1075.0,41.0,6.0,0.0,0.0,0.0,0.0,0.0,0.0,0.0,26.2,6.8,simple assignment,m,1986,English,OSA,Philosophy,1.0,0
285,0285c,"Explain why Quine's paradox: '""yields a falsehood when appended to its own quotation"" yields a falsehood when appended to its own quotation' is a paradox. Compare and contrast Quine's paradox with the Liar paradox and discuss the significance of any differences.",1.0,5/1/06,Diagonal Arguments,essay,Philosophy,AH,M,1526.0,74.0,8.0,0.0,0.0,0.0,0.0,0.0,0.0,0.0,20.6,9.3,simple assignment,m,1986,English,OSA,Philosophy,1.0,0
285,0285d,"If 'I exist' is a well formed claim, does this undermine the objection to the ontological argument that says that 'exist' is not a predicate?",1.0,11/1/05,Introduction to Philosophy,essay,Philosophy,AH,M,1502.0,53.0,7.0,0.0,0.0,0.0,0.0,0.0,0.0,0.0,28.3,7.6,simple assignment,m,1986,English,OSA,Philosophy,1.0,0
285,0285e,Critically consider the 'Method of Doubt' as a means of beginning philosophy,1.0,11/1/05,Descartes &amp; Locke,essay,Philosophy,AH,M,1917.0,76.0,9.0,0.0,0.0,2.0,0.0,0.0,0.0,0.0,25.2,8.4,simple assignment,m,1986,English,OSA,Philosophy,1.0,0
287,0287a,Monopoly And Resource Allocation,3.0,12/1/03,Economics 2,essay,Economics,SS,M,2100.0,104.0,38.0,0.0,0.0,0.0,2.0,0.0,4.0,0.0,20.2,2.7,simple assignment,f,1984,Chinese unspecified,UK2,MORSE,1.0,1
287,0287b,Stabilisation Policy,3.0,4/1/04,Economics 2,essay,Economics,SS,M,2169.0,107.0,45.0,0.0,0.0,0.0,3.0,0.0,0.0,0.0,20.3,2.4,simple assignment,f,1984,Chinese unspecified,UK2,MORSE,1.0,1
287,0287d,Corporate Dividends and Stock Repurchases,3.0,4/1/05,Topics in Financial Economics: Theories and International Finance,essay,Economics,SS,M,2538.0,105.0,48.0,0.0,1.0,0.0,2.0,1.0,9.0,0.0,24.2,2.2,simple assignment,f,1984,Chinese unspecified,UK2,MORSE,1.0,1
291,0291b,Individual Assignment For Critical Issues In IS Research and Practice,4.0,2/1/06,Critical Issues in Information Systems Research and Practice,essay,Business,SS,D,2532.0,102.0,26.0,0.0,1.0,0.0,0.0,0.0,0.0,1.0,24.8,3.9,simple assignment,m,1980,Chinese Cantonese,OSA,Information Systems and Management,1.0,1
291,0291e,Management Information Strategies and the SME,4.0,5/1/06,Management Information Systems Strategies,essay,Business,SS,M,2564.0,115.0,46.0,0.0,5.0,0.0,0.0,0.0,0.0,0.0,22.3,2.5,simple assignment,m,1980,Chinese Cantonese,OSA,Information Systems and Management,1.0,1
292,0292a,What is Locke's account of the difference between knowledge and judgement? Is his account defensible?,1.0,1/1/05,Descartes &amp; Locke,essay,Philosophy,AH,M,2393.0,95.0,11.0,0.0,0.0,0.0,0.0,0.0,4.0,0.0,25.2,8.6,simple assignment,m,1984,English,UKA,PPE,1.0,0
292,0292b,If The Way Of Truth Is True Why Does Parmenides Write The Way Of Seeming?,1.0,12/1/04,Introduction to Ancient Philosophy,essay,Philosophy,AH,M,2350.0,65.0,8.0,0.0,0.0,0.0,0.0,0.0,0.0,0.0,36.2,8.1,simple assignment,m,1984,English,UKA,PPE,1.0,0
292,0292c,What does Descartes mean by a 'real distinction between mind and body'? How does his argument for the real distinction work?,1.0,5/1/05,Descartes &amp; Locke,essay,Philosophy,AH,M,2730.0,70.0,6.0,0.0,0.0,0.0,0.0,0.0,0.0,0.0,39.0,11.7,simple assignment,m,1984,English,UKA,PPE,1.0,0
292,0292d,Mao only left one positive legacy for China: He convinced not only the people but also other party leaders that communism didn't work. Discuss.,2.0,12/1/05,Politics of Contemporary China,essay,Politics,SS,M,1883.0,62.0,8.0,0.0,0.0,0.0,0.0,0.0,0.0,0.0,30.4,7.8,simple assignment,m,1984,English,UKA,PPE,1.0,0
292,0292e,Locke asked 'Why should men who were afraid of polecats and foxes arrange to be devoured by lions?' Would Hobbes have an answer?,1.0,3/1/06,Introduction to Moral and Political Philosophy,essay,Philosophy,AH,M,1620.0,50.0,5.0,0.0,0.0,0.0,0.0,0.0,0.0,0.0,32.4,10.0,simple assignment,m,1984,English,UKA,PPE,1.0,0
292,0292f,Does China disprove the popular understanding that economic liberalisation inevitably leads to political liberalisation?,2.0,5/1/06,Politics of Contemporary China,essay,Politics,SS,M,5453.0,142.0,16.0,0.0,0.0,0.0,0.0,0.0,0.0,0.0,38.4,8.9,simple assignment,m,1984,English,UKA,PPE,1.0,1
293,0293a,"When it comes to intra-regional economic cooperation, East Asian countries have never escaped the position of latecomers.",4.0,2/1/06,East Asian Development Models and the Asia-Pacific Region,essay,Politics,SS,M,5137.0,202.0,66.0,0.0,0.0,1.0,0.0,1.0,0.0,1.0,25.4,3.1,simple assignment,m,1968,Korean,OSA,IPE,1.0,1
293,0293b,"Before NAFTA, it was widely believed that market integration was likely between the countries equally developed and that a gap in economic development would be an obstacle to successful integration.",4.0,5/1/06,Politics of International Trade,essay,Politics,SS,M,5404.0,190.0,70.0,0.0,0.0,0.0,0.0,1.0,0.0,1.0,28.4,2.7,simple assignment,m,1968,Korean,OSA,IPE,1.0,1
293,0293c,This essay aims at the assessment of the explanatory utility of liberal IPE and the benefit of free trade in explaining globalisation.,4.0,3/1/06,Theories and Issues in International Political Economy,essay,Politics,SS,M,2164.0,97.0,32.0,0.0,0.0,0.0,0.0,1.0,0.0,1.0,22.3,3.0,simple assignment,m,1968,Korean,OSA,IPE,1.0,1
293,0293d,An old-fashioned debate between free trade and protectionism is recently re-emerging in the form of wrangling between multilateralism and bilateralism.,4.0,5/1/06,Theories and Issues in International Political Economy,essay,Politics,SS,M,5177.0,183.0,73.0,0.0,0.0,0.0,0.0,1.0,0.0,1.0,28.3,2.5,simple assignment,m,1968,Korean,OSA,IPE,1.0,1
294,0294a,How successful is Socrates' attempt in the Republic to prove that justice pays the practitioner better than injustice?,1.0,3/1/05,Introduction to Ancient Philosophy,essay,Philosophy,AH,D,2246.0,87.0,12.0,0.0,0.0,0.0,0.0,0.0,0.0,0.0,25.8,7.3,simple assignment,m,1985,English,UKA,Philosophy,1.0,0
294,0294b,Assess the importance of Logos in Heraclitus' thought,1.0,11/1/04,Introduction to Ancient Philosophy,essay,Philosophy,AH,D,2624.0,117.0,24.0,0.0,0.0,12.0,0.0,0.0,0.0,0.0,22.4,4.9,simple assignment,m,1985,English,UKA,Philosophy,1.0,0
294,0294c,Outline Jackson's 'knowledge argument' and evaluate one argument with which a physicalist might respond,1.0,11/1/04,Introduction to Philosophy,essay,Philosophy,AH,M,1336.0,62.0,15.0,0.0,0.0,0.0,0.0,0.0,0.0,0.0,21.5,4.1,simple assignment,m,1985,English,UKA,Philosophy,1.0,0
294,0294d,Does the idea of a mind presuppose that of a person? Explain and discuss with reference to Descartes and Strawson.,1.0,3/1/05,Doing Philosophy,essay,Philosophy,AH,M,1177.0,49.0,13.0,0.0,0.0,3.0,0.0,0.0,0.0,0.0,24.0,3.8,simple assignment,m,1985,English,UKA,Philosophy,1.0,0
294,0294e,Can you swap bodies with someone else?,1.0,3/1/05,Doing Philosophy,essay,Philosophy,AH,M,1489.0,60.0,11.0,0.0,0.0,1.0,0.0,0.0,0.0,0.0,24.8,5.5,simple assignment,m,1985,English,UKA,Philosophy,1.0,0
294,0294g,Set out and assess Berkeley's objections to Locke's appeal to the notion of resemblance in the account of our perception of mind-independent physical things.,2.0,11/1/05,History of Modern Philosophy,essay,Philosophy,AH,M,2369.0,95.0,19.0,0.0,0.0,4.0,0.0,0.0,0.0,0.0,24.9,5.0,simple assignment,m,1985,English,UKA,Philosophy,1.0,0
294,0294h,Should morality be private?,2.0,11/1/05,Ethics I,essay,Philosophy,AH,M,3275.0,130.0,19.0,0.0,0.0,0.0,0.0,0.0,0.0,0.0,25.2,6.8,simple assignment,m,1985,English,UKA,Philosophy,1.0,0
294,0294i,What is an indexical? What special problems do indexicals create for a theory of sense?,2.0,11/1/05,Philosophy of Thought and Language I,essay,Philosophy,AH,M,2088.0,95.0,24.0,0.0,0.0,7.0,0.0,0.0,0.0,0.0,22.0,4.0,simple assignment,m,1985,English,UKA,Philosophy,1.0,0
294,0294j,How significantly does Burke's account of the sublime differ from that of Kant's?,2.0,11/1/05,Aesthetics I,essay,Philosophy,AH,M,2257.0,100.0,23.0,0.0,0.0,3.0,0.0,0.0,0.0,0.0,22.6,4.3,simple assignment,m,1985,English,UKA,Philosophy,1.0,0
296,0296c,"Why would a company choose to enter an international joint venture? What advantages does this offer over other modes of international expansion? Given the high 'failure' rate of international joint ventures, what can be done to increase the likelihood of a successful outcome? Use examples throughout.",4.0,7/1/06,International Business,essay,Business,SS,D,3332.0,147.0,48.0,0.0,0.0,0.0,0.0,0.0,0.0,0.0,22.7,3.1,simple assignment,m,1967,Pulaar,OSA,MBA,1.0,1
299,0299a,Explain the theoretical differences between the Solow and the Endogenous Growth models. What are their implications for the distribution of income levels across the world? Discuss the applicability of each model for different real-world economic areas or possible scenarios.,2.0,12/1/05,Macroeconomics,essay,Economics,SS,M,2307.0,119.0,20.0,0.0,3.0,0.0,0.0,0.0,0.0,0.0,19.4,6.0,simple assignment,f,1986,Chinese unspecified,UK1,Economics,1.0,0
299,0299b,"What do Classical, Keynesian and New Keynesian models imply for the aggregate supply relationship? What impact can monetary and fiscal policy have in these models?",2.0,12/1/05,Macroeconomics,essay,Economics,SS,M,1811.0,104.0,11.0,0.0,0.0,0.0,0.0,0.0,0.0,0.0,17.4,9.5,simple assignment,f,1986,Chinese unspecified,UK1,Economics,1.0,0
301,0301a,Explain the pros and contras of a rule that sets limits on budget deficits and debt levels of different government within a given currency area. Illustrate your answer using real-world examples.,2.0,11/1/05,Macroeconomics,essay,Economics,SS,M,2033.0,97.0,42.0,2.0,0.0,0.0,14.0,0.0,0.0,0.0,21.0,2.3,simple assignment,m,1983,English,OSA,Economics,1.0,0
302,0302c,Critically assess Locke's view that political authority rests on the consent of the governed.,2.0,11/1/05,Political Theory from Hobbes,essay,Politics,SS,M,1698.0,66.0,10.0,0.0,0.0,0.0,0.0,0.0,0.0,0.0,25.7,6.6,simple assignment,f,1985,English,UKA,History and Politics,1.0,0
302,0302d,To what degree have political parties regained their importance in US politics?,2.0,11/1/05,Politics of the USA,essay,Politics,SS,M,1460.0,45.0,7.0,0.0,0.0,0.0,0.0,0.0,0.0,0.0,32.4,6.4,simple assignment,f,1985,English,UKA,History and Politics,1.0,0
302,0302h,To what extent can a president's success be measured by his popularity?,2.0,4/1/06,Politics of the USA,essay,Politics,SS,M,5422.0,195.0,16.0,0.0,2.0,0.0,0.0,0.0,0.0,0.0,27.8,12.2,simple assignment,f,1985,English,UKA,History and Politics,1.0,0
303,0303a,"Could there be a World that is Physically Identical to ours, but in which Consciousness does not Exist? Explain and Discuss the role that the Question plays In Kripke's Argument.",2.0,12/1/05,Philosophy of Mind I,essay,Philosophy,AH,M,2786.0,84.0,20.0,0.0,0.0,6.0,0.0,0.0,0.0,0.0,33.2,4.2,simple assignment,m,1986,English,UKA,V500,1.0,0
303,0303b,Transcendence and Creation,2.0,4/1/06,Philosophy of Religion,essay,Philosophy,AH,M,2686.0,97.0,26.0,0.0,0.0,4.0,0.0,0.0,0.0,0.0,27.7,3.7,simple assignment,m,1986,English,UKA,V500,1.0,0
303,0303c,"If the Way of Truth is true, why does Parmenides write the Way of Seeming?",1.0,11/1/04,Introduction to Ancient Philosoph,essay,Philosophy,AH,D,2195.0,67.0,13.0,0.0,0.0,0.0,0.0,0.0,0.0,0.0,32.8,5.2,simple assignment,m,1986,English,UKA,V500,1.0,0
303,0303d,How Can it be Decided What a Human Right Is?,1.0,3/1/05,Introduction to Moral and Political Philosophy,essay,Philosophy,AH,M,1898.0,69.0,15.0,0.0,0.0,1.0,0.0,0.0,3.0,0.0,27.5,4.6,simple assignment,m,1986,English,UKA,V500,1.0,0
303,0303e,What is the Private Language Argument? What are its implications for the Cartesian Subject?,1.0,11/1/04,Introduction to Philosophy,essay,Philosophy,AH,M,1503.0,58.0,14.0,0.0,0.0,0.0,0.0,0.0,0.0,0.0,25.9,4.1,simple assignment,m,1986,English,UKA,V500,1.0,0
303,0303f,Hume Gives Two Definitions of Cause in the Treatise. Say How These Definitions Differ From One Another. Do You Think We can Accept Them Both?,1.0,3/1/05,Doing Philosophy,essay,Philosophy,AH,M,1231.0,44.0,8.0,0.0,0.0,0.0,0.0,0.0,0.0,0.0,28.0,5.5,simple assignment,m,1986,English,UKA,V500,1.0,0
303,0303g,Is Self-Reference the Cause of the Liar Paradox?,1.0,4/1/05,Diagonal Arguments,essay,Philosophy,AH,M,1406.0,59.0,18.0,0.0,0.0,5.0,0.0,0.0,2.0,0.0,23.8,3.3,simple assignment,m,1986,English,UKA,V500,1.0,0
303,0303h,Is Protagoras' Moral Relativism Equivalent to Modern Ethical Relativism?,2.0,11/1/05,Ethics I,essay,Philosophy,AH,D,3302.0,138.0,33.0,0.0,0.0,5.0,0.0,0.0,5.0,0.0,23.9,4.2,simple assignment,m,1986,English,UKA,V500,1.0,1
303,0303i,"In What Way, If Any, Is 'pain is c-fibre stimulation' Different From 'heat is molecular motion'? Discuss With Reference to Kripke's Argument",2.0,4/1/06,Philosophy of Mind I,essay,Philosophy,AH,M,2513.0,99.0,15.0,0.0,0.0,2.0,0.0,0.0,0.0,0.0,25.4,6.6,simple assignment,m,1986,English,UKA,V500,1.0,0
303,0303j,Does Morality Need Religion?,2.0,11/1/05,Philosophy of Religion,essay,Philosophy,AH,M,2635.0,109.0,18.0,0.0,0.0,1.0,0.0,0.0,0.0,0.0,24.2,6.1,simple assignment,m,1986,English,UKA,V500,1.0,1
307,0307a,Law and the International Business Environment,2.0,5/1/06,Law and the International Business Environment,essay,Law,SS,D,2664.0,83.0,19.0,0.0,0.0,1.0,0.0,0.0,0.0,0.0,32.1,4.4,complex but non-compound assignment (see notesStmt for details),m,1984,English,UKA,Law and Business Studies,1.0,1
311,0311k,Is the Simplicity of a Theory any Guide to its Truth?,3.0,1/1/05,Scientific Method,essay,Philosophy,AH,M,1495.0,75.0,25.0,0.0,0.0,0.0,3.0,1.0,0.0,0.0,19.9,3.0,simple assignment,m,1984,English,UKA,MPhys,1.0,0
311,0311l,Are There Satisfactory Criteria For Separating Science From Non-Science?,3.0,4/1/05,Scientific Method,essay,Philosophy,AH,M,3725.0,155.0,51.0,0.0,0.0,6.0,0.0,0.0,0.0,0.0,24.0,3.0,simple assignment,m,1984,English,UKA,MPhys,1.0,1
311,0311m,"Explain the distinction between the validity of an argument and the truth of its conclusions, and discuss the importance of this distinction both for mathematics and for experimental science.",3.0,1/1/05,Scientific Method,essay,Philosophy,AH,M,532.0,27.0,11.0,3.0,0.0,0.0,0.0,0.0,0.0,0.0,19.7,2.5,simple assignment,m,1984,English,UKA,MPhys,1.0,0
312,0312a,"Humanitarian intervention is a subject on which there is significant debate regarding both the substance of current law, and the normative question of what the law should be. Discuss.",2.0,4/1/06,International Law,essay,Law,SS,M,2507.0,94.0,7.0,0.0,0.0,0.0,0.0,0.0,0.0,0.0,26.7,13.4,simple assignment,f,1985,Malay,UK1.5,LLB,1.0,1
312,0312b,"Discuss: ""Custom is now of limited importance as a source of International Law.""",2.0,2/1/06,International Law,essay,Law,SS,D,2509.0,112.0,6.0,0.0,0.0,0.0,0.0,0.0,0.0,0.0,22.4,18.7,simple assignment,f,1985,Malay,UK1.5,LLB,1.0,0
312,0312c,This essay will explore the different concepts pertaining to legal parentage and parental responsibility in family law; focusing on how legal parentage is determined in common law and following the enactment of the Human Fertilisation and Embryology Act 1990 (HFEA 1990).,2.0,4/1/06,Law and the Family,essay,Law,SS,M,2454.0,103.0,12.0,0.0,0.0,0.0,0.0,0.0,0.0,1.0,23.8,8.6,simple assignment,f,1985,Malay,UK1.5,LLB,1.0,1
312,0312d,Discuss the significance of EU citizenship with particular reference Case C-209/03 R (on the application of Bidar) v Ealing LBC [2005] 2 WLR 1078.,2.0,1/1/06,Foundations of European Law,essay,Law,SS,M,2506.0,84.0,6.0,0.0,0.0,0.0,0.0,0.0,0.0,0.0,29.8,14.0,simple assignment,f,1985,Malay,UK1.5,LLB,1.0,0
312,0312e,This essay will explore the rule against bias; nemo judex in causa sua in the context of the given scenario.,2.0,4/1/06,General Principles of Constitutional &amp; Administrative Law,essay,Law,SS,M,2551.0,113.0,10.0,0.0,0.0,0.0,0.0,0.0,0.0,1.0,22.6,11.3,simple assignment,f,1985,Malay,UK1.5,LLB,1.0,1
312,0312f,Competition law is a pointless tool in the hands of competition authorities if it is not backed by stringent powers of enforcement.',3.0,1/1/07,Introduction to Competition Law,essay,Law,SS,M,2520.0,95.0,10.0,0.0,0.0,0.0,0.0,0.0,0.0,0.0,26.5,9.5,simple assignment,f,1985,English,UK1.5,LLB,1.0,1
312,0312g,Without being overly presumptuous it can surely be asserted that Judaeo-Christian theology has shaped the underlying structure of the laws of Western Civilization.,3.0,4/1/07,"Origins, Images and Cultures of English Law",essay,Law,SS,M,2531.0,113.0,6.0,0.0,0.0,0.0,0.0,0.0,0.0,0.0,22.4,18.8,simple assignment,f,1985,English,UK1.5,LLB,1.0,1
312,0312h,"Assess the usefulness of Charles Dickens's Bleak House in interpreting the law, practice, institutions and personnel involved in the work of the old Court of Chancery (1800-1875).",3.0,4/1/07,Law of Trusts,essay,Law,SS,M,5042.0,200.0,6.0,0.0,0.0,0.0,0.0,0.0,0.0,0.0,25.2,33.3,simple assignment,f,1985,English,UK1.5,LLB,1.0,1
312,0312i,Human rights atrocities have become a focal point in this global era through the many egregious acts committed by individuals over the past few decades.,3.0,1/1/07,International Criminal Law,essay,Law,SS,M,2505.0,116.0,10.0,0.0,0.0,0.0,0.0,0.0,0.0,0.0,21.6,11.6,simple assignment,f,1985,English,UK1.5,LLB,1.0,1
314,0314a,What benefits are there to tracing long term processes of social change?,2.0,5/1/06,Theoretical Ideas in Sociology,essay,Sociology,SS,M,2574.0,84.0,11.0,0.0,0.0,0.0,0.0,0.0,0.0,0.0,30.6,7.6,simple assignment,m,1982,English,UKA,History/Sociology,1.0,0
314,0314b,How useful is it to separate the 'form' of social life from its 'content'?,2.0,5/1/05,Theoretical Ideas in Sociology,essay,Sociology,SS,M,3367.0,104.0,14.0,0.0,0.0,0.0,0.0,0.0,0.0,0.0,32.4,7.4,simple assignment,m,1982,English,UKA,History/Sociology,1.0,0
314,0314c,How would you describe the relationship between science and society in a democracy: compatible or oppositional?,2.0,5/1/06,"Sociology of Science, Knowledge and Intellectuals",essay,Sociology,SS,M,3846.0,182.0,29.0,0.0,0.0,0.0,0.0,0.0,0.0,0.0,21.1,6.3,simple assignment,m,1982,English,UKA,History/Sociology,1.0,0
314,0314d,What were the class and gender implications of the rise of professional medicine? Discuss in relation to obstetrics and childbirth and women's madness.,1.0,5/1/04,"Gender, Class and Empire",essay,Sociology,SS,M,2156.0,69.0,10.0,0.0,0.0,0.0,0.0,0.0,0.0,0.0,31.2,6.9,simple assignment,m,1982,English,UKA,History/Sociology,1.0,0
314,0314e,Analyse the ways in which the image of the 'street waif' was constructed and to what intent.,1.0,5/1/04,"Gender, Class and Empire",essay,Sociology,SS,M,1667.0,60.0,8.0,0.0,0.0,0.0,0.0,0.0,0.0,0.0,27.8,7.5,simple assignment,m,1982,English,UKA,History/Sociology,1.0,0
314,0314g,Why did de Tocqueville attach so much importance to associations?,1.0,5/1/04,Sociological Investigation and Imagination,essay,Sociology,SS,M,2142.0,70.0,9.0,0.0,0.0,0.0,0.0,0.0,0.0,0.0,30.6,7.8,simple assignment,m,1982,English,UKA,History/Sociology,1.0,0
314,0314i,To what extent did relations with the Soviet Union and American Left shape the character of the Mexican Revolution?,3.0,5/1/06,"Race, History and Nation in Mexico",essay,History,AH,M,2159.0,59.0,8.0,0.0,0.0,0.0,0.0,0.0,0.0,0.0,36.6,7.4,simple assignment,m,1982,English,UKA,History/Sociology,1.0,0
315,0315c,"The Commission is Organised on the Pattern of a Government (K. P. E. Lasok - ""Law and Institutions of the European Union"" (2001) at 235). Is it Accurate to Describe the Commission as the Government of the EU?",2.0,12/1/04,Foundations of European Law,essay,Law,SS,M,2473.0,122.0,14.0,0.0,0.0,0.0,0.0,0.0,0.0,0.0,20.3,8.7,simple assignment,f,1986,English,UKA,LLB,1.0,1
315,0315d,Environmental Law is now a specific area of policy-making in the EU. Discuss with reference to specific legal principles adopted in this area.,2.0,3/1/05,Law &amp; Policies of the European Union,essay,Law,SS,M,2442.0,125.0,15.0,0.0,0.0,0.0,0.0,0.0,0.0,0.0,19.5,8.3,simple assignment,f,1986,English,UKA,LLB,1.0,1
318,0318e,Constantin von Neurath (1873-1956),3.0,1/1/06,Eastern Europe in Crisis,essay,History,AH,D,2208.0,88.0,17.0,0.0,0.0,0.0,0.0,0.0,0.0,0.0,25.1,5.2,simple assignment,f,1985,English,UKA,History,1.0,0
318,0318f,The rise and fall of the Third Reich,3.0,3/1/06,Eastern Europe in Crisis,essay,History,AH,D,3001.0,107.0,13.0,0.0,0.0,0.0,0.0,0.0,0.0,0.0,28.0,8.2,simple assignment,f,1985,English,UKA,History,1.0,0
318,0318g,Leopold von Ranke (1795-1886),3.0,1/1/06,Historiography,essay,History,AH,D,2291.0,115.0,24.0,0.0,0.0,0.0,0.0,0.0,0.0,0.0,19.9,4.8,simple assignment,f,1985,English,UKA,History,1.0,0
319,0319a,Value and Labour: the Sociological Significance of Labor Theory of Value,4.0,1/1/07,Marx's Social Theory,essay,Sociology,SS,M,5114.0,218.0,52.0,0.0,0.0,6.0,0.0,0.0,0.0,0.0,23.5,4.2,simple assignment,f,1984,Chinese Mandarin,OSA,Sociology,1.0,1
319,0319b,An Alternative Interpretation of Hobbes's State of Nature,4.0,1/1/07,Politics and Social Theory 1,essay,Sociology,SS,M,4567.0,180.0,40.0,1.0,1.0,3.0,0.0,0.0,0.0,0.0,25.4,4.5,simple assignment,f,1984,Chinese Mandarin,OSA,Sociology,1.0,1
320,0320f,"Critically examine the extent to which adding micro-nutrients (vitamins and minerals) is an appropriate response to nutritional problems, using examples to illustrate your argument.",3.0,5/1/06,Politics of Food and Nutrition,essay,Sociology,SS,M,2726.0,87.0,25.0,0.0,0.0,0.0,0.0,1.0,0.0,0.0,31.3,3.5,simple assignment,f,1958,English,UKA,Sociology,1.0,0
320,0320g,To what extent are holistic healing systems alternative or complementary to 'scientific' medicine?,3.0,5/1/05,Contemporary Health Issues,essay,Sociology,SS,M,2508.0,75.0,12.0,0.0,0.0,0.0,0.0,0.0,0.0,0.0,33.4,6.3,simple assignment,f,1958,English,UKA,Sociology,1.0,1
320,0320h,What accounts for the differences in offending between girls and boys?,3.0,5/1/05,Youth and Society,essay,Sociology,SS,M,1640.0,60.0,6.0,0.0,0.0,0.0,0.0,0.0,0.0,0.0,27.3,10.0,simple assignment,f,1958,English,UKA,Sociology,1.0,1
320,0320i,What considerations frame debates around delinquency among girls?,3.0,5/1/06,Youth and Society,essay,Sociology,SS,M,4125.0,136.0,19.0,0.0,0.0,0.0,0.0,0.0,0.0,0.0,30.3,7.2,simple assignment,f,1958,English,UKA,Sociology,1.0,0
320,0320j,"Hebdige was a member of the Centre for Contemporary Cultural Studies, University of Birmingham (CCCs) during the 1970s, who challenged the entrenched view of youth as trouble or in trouble",3.0,5/1/06,Youth and Society,essay,Sociology,SS,M,4430.0,128.0,17.0,0.0,0.0,0.0,0.0,0.0,0.0,0.0,34.6,7.5,simple assignment,f,1958,English,UKA,Sociology,1.0,0
324,0324b,"Does Rawls's conception of ""justice as fairness"" provide a superior alternative to utilitarian conceptions of justice?",3.0,1/1/07,Issues of Political Theory,essay,Politics,SS,M,1589.0,61.0,20.0,0.0,0.0,0.0,0.0,0.0,2.0,0.0,26.0,3.0,simple assignment,f,1985,English,OSA,Politics and International Studies,1.0,1
350,0350a,In the Search of Political Leaders - A Review of the Bureaucratic Governance of Hong Kong under the Political Thoughts of Max Weber,4.0,12/1/06,Politics and Social Theory 1,essay,Sociology,SS,M,4642.0,157.0,36.0,0.0,0.0,0.0,0.0,0.0,0.0,0.0,29.6,4.4,simple assignment,f,1980,Chinese Cantonese,OSA,Sociology,1.0,1
350,0350c,"A Comparison Between ""Asylums: Essays on the Social Situation of Mental Patients"" by Erving Goffman; and ""Critical Realist Ethnography: The Case of Racism and Professionalism in a Medical Setting"" by Sam Porter.",4.0,11/1/06,Researching Society,essay,Sociology,SS,M,1565.0,63.0,18.0,0.0,0.0,0.0,0.0,0.0,0.0,0.0,24.8,3.5,simple assignment,f,1980,Chinese Cantonese,OSA,Sociology,1.0,0
360,0360a,Should the World Bank be reformed or abolished?,4.0,3/1/07,Theories and Histories of International Development Law and Human Rights,essay,Law,SS,M,591.0,16.0,5.0,0.0,0.0,0.0,0.0,0.0,0.0,0.0,36.9,3.2,simple assignment,f,1981,Arabic,OSA,LLM in International Development Law and Human Rights,1.0,0
360,0360b,Globalisation and Global Governance,4.0,11/1/06,Theories and Histories of International Development Law and Human Rights,essay,Law,SS,D,951.0,32.0,14.0,0.0,0.0,0.0,0.0,0.0,6.0,0.0,29.7,2.3,simple assignment,f,1981,Arabic,OSA,LLM in International Development Law and Human Rights,1.0,0
360,0360c,Refugees and the principle of Burden-Sharing,4.0,12/1/06,Approaches to Global Justice,essay,Law,SS,D,2949.0,70.0,20.0,0.0,0.0,1.0,0.0,0.0,0.0,0.0,42.1,3.5,simple assignment,f,1981,Arabic,OSA,LLM in International Development Law and Human Rights,1.0,1
360,0360d,Child Soldiers and International Humanitarian Law,4.0,12/1/06,International Humanitarian Law,essay,Law,SS,M,2303.0,66.0,22.0,0.0,0.0,0.0,0.0,0.0,1.0,0.0,34.9,3.0,simple assignment,f,1981,Arabic,OSA,LLM in International Development Law and Human Rights,1.0,1
360,0360e,Female Genital Mutilation and the Efficacy of International Human Rights Law,4.0,12/1/06,Women's Human Rights,essay,Law,SS,D,2739.0,62.0,25.0,0.0,0.0,2.0,0.0,0.0,5.0,0.0,44.2,2.5,simple assignment,f,1981,Arabic,OSA,LLM in International Development Law and Human Rights,1.0,1
376,0376a,Choice of Law Rules and Laws Not Deriving from a Sovereign State,3.0,4/1/07,Conflict,essay,Law,SS,M,2293.0,113.0,31.0,0.0,0.0,0.0,0.0,0.0,0.0,0.0,20.3,3.6,simple assignment,f,1983,Finnish,OSA,Law,1.0,1
