3040,3040a,,2.0,5/1/05,Gastronomy,essay,HLTM,SS,M,2033.0,68.0,21.0,0.0,0.0,1.0,0.0,0.0,0.0,0.0,29.9,3.2,simple assignment,f,1984,English,UKa,BSc (hons) Hospitality and Tourism Management,1.0,0
3040,3040b,,3.0,11/1/05,Understanding Leisure,essay,HLTM,SS,M,1994.0,67.0,21.0,0.0,0.0,1.0,0.0,0.0,0.0,0.0,29.8,3.2,simple assignment,f,1984,English,UKa,BSc (hons) Hospitality and Tourism Management,1.0,0
3040,3040d,,2.0,4/1/05,Managing People in International H &amp; T Industries,essay,HLTM,SS,M,1190.0,42.0,13.0,0.0,0.0,0.0,0.0,0.0,0.0,0.0,28.3,3.2,simple assignment,f,1984,English,UKa,BSc (hons) Hospitality and Tourism Management,1.0,0
3041,3041a,,1.0,10/1/05,Understanding Hospitality Businesses,essay,HLTM,SS,D,2097.0,99.0,12.0,0.0,0.0,0.0,0.0,0.0,0.0,0.0,21.2,8.3,simple assignment,f,1986,English,UKa,Business and Tourism Management,1.0,0
3042,3042d,The impacts of indigenous culture based tourism in New Zealand: Ethnocentrism and its implications with regard to the commoditisation of Maori images &amp; symbols,2.0,3/1/05,Tourism Impact Analysis,essay,HLTM,SS,D,2540.0,74.0,22.0,0.0,2.0,3.0,0.0,0.0,0.0,0.0,34.3,3.4,simple assignment,m,1983,English,UKa,Tourism Management / Spanish Studies,1.0,1
3042,3042e,Synthesising tourism behaviour theory and real-life experience: Analysis of issues and implications for tourism management,2.0,4/1/05,Tourist Behaviour,essay,HLTM,SS,D,2785.0,100.0,29.0,0.0,0.0,5.0,0.0,0.0,0.0,0.0,27.9,3.4,simple assignment,m,1983,English,UKa,Tourism Management / Spanish Studies,1.0,1
3048,3048b,The Publisher and the Post-Structuralist. Are the two positions reconcilable in the cultural context of the 21st century?,4.0,4/1/06,History and Culture of Publishing,essay,Publishing,SS,D,3214.0,107.0,16.0,0.0,0.0,7.0,0.0,0.0,0.0,0.0,30.0,6.7,simple assignment,f,1984,English,UKa,MA Publishing,1.0,1
3053,3053a,"How does Japanese Anime portray women's characters, as 'weak and vulnerable' or 'strong and heroic'?",3.0,12/1/05,Japan at play,essay,Anthropology,SS,D,1829.0,93.0,23.0,0.0,14.0,0.0,0.0,0.0,0.0,0.0,19.7,4.0,simple assignment,f,1984,English,UKa,BA Anthropology/Environmental Design &amp; Conservation,1.0,0
3053,3053b,"What is meant by the term ""human-wildlife conflict"" ? Is this a phenomenon that only occurs within tropical regions of world?",3.0,12/1/05,Human Resource Ecology,essay,Anthropology,SS,M,2115.0,108.0,27.0,0.0,0.0,0.0,0.0,0.0,0.0,0.0,19.6,4.0,simple assignment,f,1984,English,UKa,BA Anthropology/Environmental Design &amp; Conservation,1.0,0
3055,3055a,"Write an essay using the ethnography, 'Traveller Gypsies', to show how ideas about dirt and cleanliness, pollution and/or taboo may be related to systems of classification",1.0,11/1/05,Introduction to Social Anthropology,essay,Anthropology,SS,D,1525.0,55.0,9.0,0.0,0.0,1.0,0.0,0.0,0.0,0.0,27.7,6.1,simple assignment,f,1986,English,UKa,BA Anthropology/Psychology,1.0,0
3060,3060a,"There is a growing trend in the zoological, veterinary and laboratory animal community to recognise the value of using operant conditioning as an animal care and",4.0,6/1/04,Captive Management and Rehabilitation,essay,Anthropology,SS,M,2303.0,128.0,21.0,0.0,0.0,0.0,0.0,0.0,0.0,0.0,18.0,6.1,simple assignment,f,1976,English,UKa,MSc Primate Conservation,1.0,0
3060,3060c,Outline and discuss patterns of geographic distribution among primates,4.0,12/1/04,"Primate Diversity, Bio-geography and Status",essay,Anthropology,SS,M,2104.0,105.0,14.0,0.0,0.0,0.0,0.0,0.0,0.0,0.0,20.0,7.5,simple assignment,f,1976,English,UKa,MSc Primate Conservation,1.0,0
3060,3060d,"Why do individuals disperse from their natal groups? Describe different dispersal strategies. What are the genetic consequences for the individual, the social group, species population structure and conservation?",4.0,3/1/04,Genetics and Population Management,essay,Anthropology,SS,M,2089.0,92.0,15.0,0.0,0.0,0.0,0.0,0.0,0.0,0.0,22.7,6.1,simple assignment,f,1976,English,UKa,MSc Primate Conservation,1.0,0
3061,3061d,What does the TOT (Tip of the Tongue) experience tell us about the way words may be retrieved in the brain and about speech production?,3.0,12/1/05,Psycholinguistics,essay,Linguistics,AH,D,2047.0,74.0,8.0,0.0,0.0,0.0,0.0,0.0,0.0,0.0,27.7,9.3,simple assignment,f,1983,German,OSa,Erasmus/Modular Diploma in Advanced Study,1.0,0
3063,3063d,,4.0,10/1/05,Human wildlife conflict issues,essay,Anthropology,SS,M,2040.0,85.0,22.0,0.0,0.0,0.0,0.0,0.0,6.0,0.0,24.0,3.9,simple assignment,f,1974,English,UKa,MSc Primate Conservation,1.0,1
3073,3073b,Visual Communication,4.0,1/1/07,Contemporary issues in international hospitality and tourism,essay,HLTM,SS,M,5472.0,140.0,34.0,1.0,0.0,0.0,0.0,0.0,0.0,1.0,39.1,4.1,simple assignment,f,1982,Chinese unspecified,OSa,MSc International Hotel and Tourism Marketing Management,1.0,1
3074,3074a,,3.0,3/1/06,Managing people in int'l hosp. and tourism industries,essay,HLTM,SS,D,1916.0,99.0,12.0,0.0,0.0,2.0,0.0,0.0,0.0,0.0,19.4,8.3,simple assignment,f,1981,German,OSa,BSc International Tourism Management,1.0,0
3075,3075a,How can Revenue Management be implemented so that all types of customers will perceive it as fair and reasonable?,2.0,3/1/06,Revenue and Profit management for Hospitality and Tourism,essay,HLTM,SS,D,1176.0,44.0,11.0,0.0,0.0,1.0,0.0,0.0,0.0,0.0,26.7,4.0,simple assignment,f,1984,English,UKa,BSc International Hospitality management,1.0,0
3075,3075b,"Commercial hosts, need to offer ""genuine"" hospitality?",1.0,12/1/03,Understanding Hospitality Businesses,essay,HLTM,SS,D,2384.0,94.0,15.0,0.0,2.0,0.0,0.0,0.0,0.0,0.0,25.4,6.3,simple assignment,f,1984,English,UKa,BSc International Hospitality management,1.0,0
3086,3086a,SVEVO AND JOYCE FRIENDSHIP: IMPROVING THE LITERARY AIM OF ONE OF THE MOST IMPORTANT ITALIAN WRITER,4.0,5/1/06,History and Culture of Publishing,essay,Publishing,SS,M,2978.0,137.0,77.0,0.0,0.0,0.0,0.0,0.0,0.0,0.0,21.7,1.8,simple assignment,f,1976,Italian,OSa,MA Publishing,1.0,1
3088,3088a,What were the ecological pressures which caused primate traits to evolve?,1.0,5/1/06,Introduction to Biological Anthropology,essay,Anthropology,SS,D,1503.0,57.0,5.0,0.0,0.0,0.0,0.0,0.0,0.0,0.0,26.4,11.4,simple assignment,f,1986,English,UKa,BA Anthropology and English,1.0,0
3088,3088b,Religion' is sometimes a difficult concept to apply to beliefs and practices....,1.0,11/1/05,Introduction to Social Anthropology,essay,Anthropology,SS,M,1358.0,56.0,8.0,0.0,0.0,0.0,0.0,0.0,0.0,0.0,24.3,7.0,simple assignment,f,1986,English,UKa,BA Anthropology and English,1.0,0
3098,3098a,"Write an essay, using ethnography or other sources about a particular people, to show how ideas about dirt...",1.0,12/1/04,Introduction to Social Anthropology,essay,Anthropology,SS,M,1214.0,54.0,6.0,0.0,0.0,0.0,0.0,0.0,0.0,0.0,22.5,9.0,simple assignment,m,1983,English,UKa,BA Anthropology and Philosophy,1.0,0
3099,3099b,Essay Question 2,1.0,12/1/05,Evidence and enquiry,essay,Philosophy,AH,M,1503.0,64.0,6.0,0.0,0.0,0.0,0.0,0.0,0.0,0.0,23.5,10.7,simple assignment,m,1984,English,OSa,BA Philosophy and Japanese Language &amp; Culture,1.0,0
3099,3099d,Essay Question 2,1.0,12/1/05,Humand Development and Learning,essay,Philosophy,AH,M,1502.0,67.0,6.0,0.0,0.0,0.0,0.0,0.0,0.0,0.0,22.4,11.2,simple assignment,m,1984,English,OSa,BA Philosophy and Japanese Language &amp; Culture,1.0,0
3101,3101a,To what extent tdo you consider that the exchange of money in the commerial sector makes the concepts of hospitality.........,1.0,11/1/04,Understanding Hospitality Businesses,essay,HLTM,SS,M,1994.0,87.0,6.0,0.0,0.0,0.0,0.0,0.0,0.0,0.0,22.9,14.5,simple assignment,f,1986,English,UKa,BA Hotel and Restaurant Management,1.0,0
3101,3101h,"Question 3: Identify, explain and evaluate a significant issue reported in academic literature concerning the effective application of revenue (or yield) management in hotels.",3.0,10/1/06,Revenue and Profit management for Hospitality and Tourism,essay,HLTM,SS,M,1065.0,44.0,7.0,0.0,0.0,0.0,0.0,0.0,0.0,0.0,24.2,6.3,simple assignment,f,1986,English,UKa,BA Hotel and Restaurant Management,1.0,0
3107,3107a,Gender identities assignment,2.0,10/1/06,Gender and Society,essay,Sociology,SS,D,715.0,26.0,5.0,0.0,0.0,0.0,0.0,0.0,0.0,0.0,27.5,5.2,simple assignment,m,1975,English,UKa,BA Sociology with Anthropology,1.0,0
3118,3118a,Professional question: How can the teaching of pronunciation gain greater prominence a pre-undergraduate EAP course?,4.0,12/1/05,Research Methods I,essay,Linguistics,AH,M,2032.0,81.0,13.0,0.0,0.0,0.0,0.0,0.0,0.0,0.0,25.1,6.2,simple assignment,f,1968,English,UKa,MA TESOL,1.0,1
3121,3121a,The translation of strategy into performance measures for the hospitality industry,4.0,1/1/07,Contemporary Issues in International Hospitality and Tourism,essay,HLTM,SS,D,4333.0,181.0,32.0,0.0,1.0,0.0,0.0,0.0,0.0,1.0,23.9,5.7,simple assignment,f,1983,French,OSa,MSc HLTM,1.0,1
3125,3125b,"Present a summary of current perspectives on how the lexicon is organised, ie how it is structured. Include in your discussion topics such as lexicalization, sense relations, and lexical composition ...",3.0,11/1/06,English grammar and lexis,essay,Linguistics,AH,M,2035.0,127.0,11.0,0.0,0.0,0.0,0.0,0.0,0.0,0.0,16.0,11.5,simple assignment,f,1984,Japanese,OSa,BA English Language and Linguistics,1.0,0
3125,3125d,Discuss the importance of language in establishing a sense of identity,1.0,4/1/05,Language and Society,essay,Linguistics,AH,M,1503.0,56.0,10.0,0.0,0.0,0.0,0.0,0.0,0.0,0.0,26.8,5.6,simple assignment,f,1984,Japanese,OSa,BA English Language and Linguistics,1.0,0
3125,3125e,Psycholinguistics essay,3.0,12/1/06,Psychology of language,essay,Linguistics,AH,M,1990.0,108.0,12.0,0.0,0.0,0.0,0.0,0.0,0.0,0.0,18.4,9.0,simple assignment,f,1984,Japanese,OSa,BA English Language and Linguistics,1.0,0
3125,3125g,Argumentative paper,2.0,12/1/05,Sociolinguistics,essay,Linguistics,AH,M,1946.0,111.0,28.0,0.0,0.0,0.0,3.0,0.0,0.0,0.0,17.5,4.0,simple assignment,f,1984,Japanese,OSa,BA English Language and Linguistics,1.0,0
3126,3126b,"Discuss, with examples, how the attitudes of different people to gifts and exchange may reveal broader information about their social organisation.",1.0,11/1/05,Introduction to Social Anthropology,essay,Anthropology,SS,M,2211.0,89.0,19.0,0.0,0.0,0.0,0.0,0.0,0.0,0.0,24.8,4.7,simple assignment,f,1985,English,UKa,BA Anthropology and Sociology,1.0,0
3127,3127a,Should ESOL teachers be trusted to create their own approaches to learning?,4.0,12/1/06,Language learning principles and practices,essay,Linguistics,AH,D,3402.0,149.0,37.0,0.0,0.0,0.0,0.0,0.0,5.0,1.0,22.8,4.0,simple assignment,f,1964,English,UKa,MA Tesol,1.0,1
3127,3127b,Compare and contrast two 'authentic' texts (spoken or written) identiying some of the choices (linguistic and pragmatic) that 'realise' the particular set of 'goals' and purposes...,4.0,12/1/06,descriptions of English,essay,Linguistics,AH,M,3417.0,154.0,53.0,3.0,0.0,0.0,6.0,4.0,0.0,0.0,22.2,2.9,simple assignment,f,1964,English,UKa,MA Tesol,1.0,1
3128,3128a,Should ESOL teachers be trusted to create their own approaches to learning?,4.0,1/1/07,Language learning principles and practices,essay,Linguistics,AH,M,2859.0,116.0,29.0,0.0,0.0,2.0,0.0,1.0,0.0,0.0,24.6,4.0,simple assignment,f,1977,Bulgarian,OSa,MA Tesol,1.0,1
3128,3128b,Analysing a language point,4.0,1/1/07,Language learning principles and practices,essay,Linguistics,AH,M,3227.0,156.0,51.0,0.0,1.0,1.0,0.0,2.0,9.0,0.0,20.7,3.1,simple assignment,f,1977,Bulgarian,OSa,MA Tesol,1.0,1
3135,3135c,"Discuss some of the ways in which a society manages to maintian a degree of social and moral order amongst its members. Try to use informal examples as well as formal ones, and to provide ethnographic illustrations of your ideas.",1.0,11/1/05,Introduction to Social Anthropology,essay,Anthropology,SS,M,2232.0,96.0,16.0,0.0,0.0,0.0,0.0,0.0,0.0,0.0,23.3,6.0,simple assignment,f,1986,English,UKa,BA Anthropology and Sociology,1.0,0
3145,3145a,Does functionalism offer a more plausible theory of intentional states than it does of sensations and other states of consciousness?,2.0,12/1/06,Philosophy of mind,essay,Philosophy,AH,M,2323.0,84.0,9.0,0.0,0.0,0.0,0.0,0.0,0.0,0.0,27.7,9.3,simple assignment,f,1987,English,UKa,BA Philosophy with Sociology,1.0,0
3145,3145b,The realisty of evil makes it impossible for the God of classical theism to exist. Discuss.,2.0,12/1/06,Philosophy of religion,essay,Philosophy,AH,M,2566.0,102.0,20.0,0.0,0.0,0.0,0.0,0.0,0.0,0.0,25.2,5.1,compound assignment consisting of 2 parts (see notesStmt for details),f,1987,English,UKa,BA Philosophy with Sociology,2.0,0
3145,3145c,Critically discuss Aristotle's understanding of Eudaimonia. Can his two accounts be reconciled?,2.0,12/1/06,Ancient Greek Philosophy,essay,Philosophy,AH,M,2275.0,87.0,14.0,0.0,0.0,3.0,0.0,0.0,0.0,0.0,26.1,6.2,simple assignment,f,1987,English,UKa,BA Philosophy with Sociology,1.0,0
3147,3147a,Critically evaluate the ideas on God and/or religion of one of the figures covered on this course,2.0,12/1/05,God in continental thought,essay,Philosophy,AH,M,2133.0,104.0,23.0,0.0,0.0,12.0,0.0,0.0,0.0,0.0,20.5,4.5,simple assignment,f,1986,English,UKa,BA English and Philosophy,1.0,0
3147,3147c,"Which, in your opinion is the most plausible account of meaning?",2.0,11/1/05,Philosophy of Language,essay,Philosophy,AH,M,2176.0,115.0,32.0,0.0,0.0,17.0,0.0,0.0,0.0,0.0,18.9,3.6,simple assignment,f,1986,English,UKa,BA English and Philosophy,1.0,0
3147,3147d,To what extent would you agree with the claim that God's existence can be proved? ....,3.0,11/1/06,Philosophy of Religion,essay,Philosophy,AH,M,2692.0,141.0,36.0,0.0,0.0,7.0,0.0,0.0,0.0,0.0,19.1,3.9,compound assignment consisting of 2 parts (see notesStmt for details),f,1986,English,UKa,BA English and Philosophy,2.0,0
3147,3147f,The central argument of Plato's Republic rests to a great extent on the analogy drawn between...,3.0,11/1/06,Ancient Greek Philosophy,essay,Philosophy,AH,M,2063.0,95.0,28.0,0.0,0.0,10.0,0.0,0.0,0.0,0.0,21.7,3.4,simple assignment,f,1986,English,UKa,BA English and Philosophy,1.0,0
3152,3152a,Standardisation of hospitality services provides customers with consistent quality and ensures that staffs are able to deliver it,1.0,11/1/06,Understanding Hospitality Businesses,essay,HLTM,SS,M,1626.0,84.0,9.0,0.0,0.0,0.0,0.0,0.0,0.0,0.0,19.4,9.3,simple assignment,f,1987,Japanese,OSa,Hospitality Management,1.0,0
3159,3159a,A Pragmatic Analysis of a script from Friends,1.0,12/1/06,Meaning in Language,essay,Linguistics,AH,M,2147.0,100.0,13.0,0.0,0.0,1.0,0.0,1.0,0.0,0.0,21.5,7.7,simple assignment,f,1981,Portuguese,OSa,BA English Language and Linguistics,1.0,0
3162,3162a,To what extent do you consider the exchange of money in the commercial sector makes the concepts of hospitality derived from the private and social domains redundant in understanding the management of the modern hospitality industry?,1.0,11/1/04,Understanding Hospitality Businesses,essay,HLTM,SS,M,2494.0,89.0,12.0,0.0,0.0,0.0,0.0,0.0,0.0,0.0,28.0,7.4,simple assignment,m,1985,English,UKa,BSc International Tourism Management,1.0,0
6006,6006a,What evidence is there for the exchange and specialization in the production of Neolithic artefacts in the Aegean?,4.0,12/1/05,Early Agricultural Societies,essay,Archaeology,AH,D,5326.0,169.0,45.0,0.0,0.0,0.0,0.0,0.0,0.0,0.0,31.5,3.8,simple assignment,f,1975,Greek,UK3,MA Archaeology,1.0,1
6006,6006c,What problems are there in reconstructing the Hellenistic city of Athens?,4.0,4/1/06,The Archaeology of the Ancient City,essay,Archaeology,AH,D,5123.0,189.0,37.0,0.0,0.0,0.0,0.0,0.0,0.0,0.0,27.1,5.1,simple assignment,f,1975,Greek,UK3,MA Archaeology,1.0,1
6006,6006d,When did the early state emerge in mainland Greece and what form did it take?,4.0,4/1/06,Early Complex Societies in the Mediterranean,essay,Archaeology,AH,D,5160.0,191.0,43.0,1.0,0.0,0.0,0.0,0.0,0.0,0.0,27.0,4.4,simple assignment,f,1975,Greek,UK3,MA Archaeology,1.0,1
6006,6006h,How far did the seas unite or divide Neolithic communities on the Cycladic islands?,4.0,11/1/05,Early Agricultural Societies,essay,Archaeology,AH,D,634.0,32.0,8.0,0.0,0.0,0.0,0.0,1.0,0.0,0.0,19.8,4.0,simple assignment,f,1975,Greek,UK3,MA Archaeology,1.0,0
6006,6006i,The Haimon Painter: a construct,4.0,3/1/06,Dissertation Module,essay,Classics,AH,D,785.0,46.0,7.0,0.0,0.0,0.0,0.0,0.0,0.0,0.0,17.1,6.6,simple assignment,f,1975,Greek,UK3,MA Archaeology,1.0,0
6009,6009b,Analysis of Spoken Discourse Sample,4.0,12/1/05,Discourse Analysis for Language Teachers,essay,Linguistics,AH,D,2576.0,116.0,17.0,0.0,0.0,0.0,0.0,0.0,0.0,0.0,22.2,6.8,simple assignment,f,1980,English,UKa,MA ELT Portfolio,1.0,1
6009,6009c,"It is inadequate to describe English obstruent phonemes as voiced and voiceless. Explain this statement, commenting on how English listeners tell the difference between voiced and voiceless obstruents in syllable initial and syllable final position.",4.0,1/1/06,Foundation Phonetics and Phonology,essay,Linguistics,AH,D,1773.0,80.0,13.0,0.0,0.0,0.0,2.0,0.0,0.0,0.0,22.2,6.2,simple assignment,f,1980,English,UKa,MA ELT Portfolio,1.0,1
6010,6010b,All varieties of English are equal. Discuss.,1.0,3/1/05,Language in the Individual and in Society,essay,Linguistics,AH,D,1649.0,96.0,19.0,0.0,0.0,1.0,0.0,0.0,0.0,0.0,17.2,5.1,simple assignment,f,1957,English,OSa,BAApplied English Language Studies,1.0,0
6010,6010e,Differences between males and females ways of talking.,2.0,1/1/06,Sociolinguistics,essay,Linguistics,AH,D,3026.0,126.0,65.0,0.0,0.0,2.0,0.0,2.0,8.0,0.0,24.0,1.9,simple assignment,f,1957,English,OSa,BAApplied English Language Studies,1.0,1
6010,6010f,Patterns and meanings are connected,2.0,1/1/06,Corpus based approaches to discourse,essay,Linguistics,AH,D,2358.0,99.0,52.0,7.0,0.0,0.0,0.0,0.0,5.0,0.0,23.8,1.9,simple assignment,f,1957,English,OSa,BAApplied English Language Studies,1.0,1
6010,6010g,Modality has nothing to do with form,2.0,1/1/06,English Grammar and Lexis,essay,Linguistics,AH,D,2193.0,169.0,119.0,0.0,0.0,2.0,52.0,0.0,0.0,0.0,13.0,1.4,simple assignment,f,1957,English,OSa,BAApplied English Language Studies,1.0,1
6018,6018b,What is the effect of the social variables of gender and class on the way we speak? Is there a link between them?,1.0,5/1/05,Language in the Individual and Society,essay,Linguistics,AH,M,1945.0,70.0,19.0,0.0,0.0,0.0,0.0,0.0,0.0,0.0,27.8,3.7,simple assignment,m,1986,English,UKa,BA Applied English Language,1.0,0
6018,6018c,"Chimpanzees can use signs, but do they have language?",1.0,12/1/04,Language in the Individual and Society,essay,Linguistics,AH,M,504.0,23.0,8.0,0.0,0.0,0.0,0.0,0.0,0.0,0.0,21.9,2.9,simple assignment,m,1986,English,UKa,BA Applied English Language,1.0,0
6018,6018d,"Children's reading and writing has to be learned, in contrast to their speech",1.0,12/1/04,Language in the Individual and Society,essay,Linguistics,AH,M,511.0,24.0,9.0,0.0,0.0,0.0,0.0,0.0,0.0,0.0,21.3,2.7,simple assignment,m,1986,English,UKa,BA Applied English Language,1.0,0
6018,6018f,Write an essay on what the differences are between males' and females' ways of talking...,2.0,1/1/06,Sociolinguistics,essay,Linguistics,AH,M,3028.0,112.0,32.0,0.0,0.0,0.0,0.0,0.0,0.0,0.0,27.0,3.5,simple assignment,m,1986,English,UKa,BA Applied English Language,1.0,0
6020,6020b,How Far Does Language After Age Five Differ From What Has Developed Up To That Point?,2.0,12/1/04,Child language development,essay,Linguistics,AH,D,2038.0,53.0,11.0,0.0,0.0,0.0,0.0,0.0,0.0,0.0,38.5,4.8,simple assignment,f,1984,English,UKa,Linguistics,1.0,0
6020,6020d,"A Case Study into the Introduction, Development and Impact of English in Hong Kong",2.0,4/1/05,English in the world,essay,Linguistics,AH,D,2767.0,75.0,17.0,0.0,0.0,5.0,0.0,0.0,0.0,0.0,36.9,4.4,simple assignment,f,1984,English,UKa,Linguistics,1.0,1
6024,6024b,No title,4.0,11/1/05,Discourse Analysis for Language Teachers,essay,Linguistics,AH,D,2585.0,106.0,15.0,0.0,0.0,0.0,0.0,0.0,0.0,0.0,24.4,7.1,simple assignment,f,1982,Greek,OSa,T.E.F.L.,1.0,1
6024,6024c,The Structure of the Syllable and its Teaching Implications,4.0,12/1/05,Foundation Phonetics and Phonology,essay,Linguistics,AH,D,2279.0,95.0,19.0,0.0,0.0,0.0,0.0,0.0,0.0,0.0,24.0,5.0,simple assignment,f,1982,Greek,OSa,T.E.F.L.,1.0,1
6029,6029a,Discuss the pursuit of justice with reference to at least two plays,2.0,3/1/05,Greek Drama,essay,Classics,AH,M,1987.0,95.0,8.0,0.0,0.0,0.0,0.0,0.0,0.0,0.0,20.9,11.9,simple assignment,f,1985,English,UKa,Archaeology and Classical Studies,1.0,1
6029,6029b,"Compare the attitudes to fighting given by Diomedes, Hector and Achilles in the Iliad",2.0,12/1/04,Ancient Epic,essay,Classics,AH,M,2466.0,118.0,15.0,0.0,0.0,0.0,0.0,0.0,0.0,0.0,20.9,7.9,simple assignment,f,1985,English,UKa,Archaeology and Classical Studies,1.0,1
6029,6029d,What is Roman about Aenaeas' heroism?,1.0,3/1/04,Rome in the Augustan Age,essay,Classics,AH,M,1932.0,82.0,13.0,0.0,0.0,0.0,0.0,0.0,0.0,0.0,23.6,6.3,simple assignment,f,1985,English,UKa,Archaeology and Classical Studies,1.0,1
6032,6032b,How are the functions of Roman towns reflected in the Archaeological record? Discuss with reference to specific sites.,1.0,3/1/05,Historic Archaeology,essay,Archaeology,AH,M,2112.0,79.0,21.0,0.0,3.0,0.0,0.0,0.0,0.0,0.0,26.7,3.8,simple assignment,f,1986,English,UKa,BA Archaeology and History joint,1.0,0
6033,6033a,What impact has archaeology had on our knowledge of the Medieval peasant?,1.0,11/1/03,Historic Archaeology,essay,Archaeology,AH,M,2045.0,101.0,12.0,0.0,0.0,0.0,0.0,0.0,0.0,0.0,20.2,8.4,simple assignment,f,1983,English,UKa,Part 3,1.0,1
6033,6033b,Were hunters cleverer than scavengers? Discuss in relation to Middle Palaeolithic subsistence strategies.,2.0,11/1/04,Middle Palaeolithic of Europe and South-West Asia,essay,Archaeology,AH,M,3174.0,132.0,10.0,0.0,0.0,0.0,0.0,0.0,0.0,0.0,24.0,13.2,simple assignment,f,1983,English,UKa,Part 3,1.0,1
6033,6033c,What was the contribution made by the army to the roman towns of Northern Europe?,2.0,11/1/04,Celts and Romans in Northern Europe,essay,Archaeology,AH,M,3211.0,139.0,8.0,0.0,0.0,1.0,0.0,0.0,0.0,0.0,23.1,17.4,simple assignment,f,1983,English,UKa,Part 3,1.0,0
6033,6033d,How far can archaeologists reconstruct past social relations using evidence for the disposal of the dead?,2.0,11/1/04,Archaeological Thought,essay,Archaeology,AH,M,3274.0,144.0,12.0,0.0,0.0,1.0,0.0,0.0,0.0,0.0,22.7,12.0,simple assignment,f,1983,English,UKa,Part 3,1.0,0
6033,6033e,What role did humans play in the extinction of Mediterranean Island faunas? Discuss in relation to Cyprus and Mallorca.,3.0,11/1/05,Early Agricultural Societies in the Mediterranean,essay,Archaeology,AH,M,3340.0,131.0,14.0,0.0,0.0,0.0,0.0,0.0,0.0,0.0,25.5,9.4,simple assignment,f,1983,English,UKa,Part 3,1.0,0
6033,6033h,How was Augustus represented as 'between god and man'?,1.0,3/1/04,Rome in the Augustan age,essay,Classics,AH,M,2039.0,82.0,15.0,0.0,0.0,2.0,0.0,0.0,0.0,0.0,24.9,5.5,simple assignment,f,1983,English,UKa,Part 3,1.0,1
6038,6038a,"(5) ""Modality is a semantic notion rather than a grammatical notion in English."" Explain why you agree or disagree with this statement.",4.0,1/1/05,English Grammar and Lexis,essay,Linguistics,AH,D,1847.0,59.0,31.0,0.0,3.0,0.0,26.0,4.0,0.0,0.0,31.3,1.9,simple assignment,f,1954,English,UKa,MA Linguistics,1.0,1
6038,6038b,"(4) Why has it been said that English 'has only two tenses'? Show how this claim is controversial, depending on how the notion of tense is characterised, and explain whether you are convinced by it.",4.0,1/1/05,English Grammar and Lexis,essay,Linguistics,AH,D,1608.0,81.0,56.0,0.0,0.0,0.0,51.0,4.0,0.0,0.0,19.9,1.4,simple assignment,f,1954,English,UKa,MA Linguistics,1.0,1
6038,6038d,(8) To what extent does contemporary English have syntactic rules for expressing quantification in: a) negative clauses and b) interrogative clauses?,4.0,4/1/05,Research Topics in English Grammar,essay,Linguistics,AH,D,3281.0,146.0,84.0,0.0,0.0,0.0,42.0,5.0,0.0,0.0,22.5,1.7,simple assignment,f,1954,English,UKa,MA Linguistics,1.0,1
6039,6039a,What are the suggested functions for the Avebury monument complex?,1.0,11/1/05,Introduction To World Pre-History,essay,Archaeology,AH,M,1808.0,66.0,16.0,0.0,0.0,0.0,0.0,0.0,0.0,0.0,27.4,4.1,simple assignment,f,1986,English,UKa,History,1.0,0
6039,6039b,"Compare and Contrast Two Towns From Different Parts of the Empire, Discussing Both Ancient and Modern Factors",1.0,3/1/06,Introduction to Historic Archaeology,essay,Archaeology,AH,M,1814.0,64.0,12.0,0.0,0.0,0.0,0.0,0.0,0.0,0.0,28.3,5.3,simple assignment,f,1986,English,UKa,History,1.0,0
6039,6039c,"Discuss with examples, why waterlogged sites are especially suitable for recovery of evidence for past environments",1.0,11/1/05,Archaeology Practise,essay,Archaeology,AH,M,602.0,21.0,4.0,0.0,0.0,0.0,0.0,0.0,0.0,0.0,28.7,5.3,simple assignment,f,1986,English,UKa,History,1.0,0
6039,6039d,Is it accurate to discuss the citizen women of Athens in terms of 'seclusion'?,1.0,12/1/05,The Civilisation of Fifth-Century Athens,essay,Classics,AH,M,1629.0,72.0,10.0,0.0,0.0,0.0,0.0,0.0,0.0,0.0,22.6,7.2,simple assignment,f,1986,English,UKa,History,1.0,0
6040,6040a,Did the Athenians treat their slaves as human beings?,1.0,12/1/05,The Civilisation of Fifth-century Athens,essay,Classics,AH,D,1620.0,35.0,9.0,0.0,0.0,0.0,0.0,0.0,0.0,0.0,46.3,3.9,simple assignment,f,1987,English,UKa,BA,1.0,0
6042,6042a,What is the effect of the social variables of class and gender on the way we speak? Is there a link between them?,1.0,3/1/05,Language and the individual and in society,essay,Linguistics,AH,M,1531.0,74.0,12.0,0.0,0.0,0.0,0.0,0.0,0.0,0.0,20.7,6.2,simple assignment,f,1984,English,UKa,BSc Speech and Language Therapy,1.0,0
6044,6044a,It is inadequate to describe English obstruent phonemes as voiced and voiceless,4.0,10/1/05,Foundation Phonetics and Phonology,essay,Linguistics,AH,D,2005.0,60.0,22.0,0.0,0.0,3.0,0.0,0.0,0.0,0.0,33.4,2.7,simple assignment,m,1968,English,UKa,MA ELT,1.0,1
